[
  {
    "id": "sent.other_nouns.b1.001",
    "topic": "other_nouns",
    "stage": "B",
    "en": "Today is my birthday.",
    "zh": "今天是我的生日。",
    "grammar_point": "名詞 birthday",
    "vocab_ids": ["voc.other_nouns.001"],
    "status": "published"
  },
  {
    "id": "sent.other_nouns.b1.002",
    "topic": "other_nouns",
    "stage": "B",
    "en": "I fill my water bottle every morning.",
    "zh": "我每天早上裝滿水瓶。",
    "grammar_point": "名詞 bottle",
    "vocab_ids": ["voc.other_nouns.002"],
    "status": "published"
  },
  {
    "id": "sent.other_nouns.b1.003",
    "topic": "other_nouns",
    "stage": "B",
    "en": "I keep my toys in a box.",
    "zh": "我把玩具放在箱子裡。",
    "grammar_point": "名詞 box",
    "vocab_ids": ["voc.other_nouns.003"],
    "status": "published"
  },
  {
    "id": "sent.other_nouns.b1.004",
    "topic": "other_nouns",
    "stage": "B",
    "en": "My mom calls me on her cell phone.",
    "zh": "我媽媽用手機打給我。",
    "grammar_point": "名詞 cell phone",
    "vocab_ids": ["voc.other_nouns.004"],
    "status": "published"
  },
  {
    "id": "sent.other_nouns.b1.005",
    "topic": "other_nouns",
    "stage": "B",
    "en": "I had a funny dream last night.",
    "zh": "我昨晚做了一個有趣的夢。",
    "grammar_point": "名詞 dream",
    "vocab_ids": ["voc.other_nouns.005"],
    "status": "published"
  },
  {
    "id": "sent.other_nouns.b1.006",
    "topic": "other_nouns",
    "stage": "B",
    "en": "She picked a yellow flower.",
    "zh": "她摘了一朵黃花。",
    "grammar_point": "名詞 flower",
    "vocab_ids": ["voc.other_nouns.006"],
    "status": "published"
  },
  {
    "id": "sent.other_nouns.b1.007",
    "topic": "other_nouns",
    "stage": "B",
    "en": "The party was so much fun.",
    "zh": "這場派對非常有趣。",
    "grammar_point": "名詞 fun / party",
    "vocab_ids": ["voc.other_nouns.007", "voc.other_nouns.010"],
    "status": "published"
  },
  {
    "id": "sent.other_nouns.b1.008",
    "topic": "other_nouns",
    "stage": "B",
    "en": "I bought a gift for my friend.",
    "zh": "我買了一份禮物給我的朋友。",
    "grammar_point": "名詞 gift",
    "vocab_ids": ["voc.other_nouns.008"],
    "status": "published"
  },
  {
    "id": "sent.other_nouns.b1.009",
    "topic": "other_nouns",
    "stage": "B",
    "en": "I got a mail from my grandma.",
    "zh": "我收到奶奶寄來的信。",
    "grammar_point": "名詞 mail",
    "vocab_ids": ["voc.other_nouns.009"],
    "status": "published"
  },
  {
    "id": "sent.other_nouns.b1.010",
    "topic": "other_nouns",
    "stage": "B",
    "en": "Let's take a photo together.",
    "zh": "我們一起拍張照片吧。",
    "grammar_point": "名詞 photo",
    "vocab_ids": ["voc.other_nouns.011"],
    "status": "published"
  },
  {
    "id": "sent.other_nouns.b1.011",
    "topic": "other_nouns",
    "stage": "B",
    "en": "My little brother has a toy robot.",
    "zh": "我弟弟有一個玩具機器人。",
    "grammar_point": "名詞 robot",
    "vocab_ids": ["voc.other_nouns.012"],
    "status": "published"
  },
  {
    "id": "sent.other_nouns.b1.012",
    "topic": "other_nouns",
    "stage": "B",
    "en": "The shoes are on sale this week.",
    "zh": "這雙鞋子這週特賣。",
    "grammar_point": "名詞 sale",
    "vocab_ids": ["voc.other_nouns.013"],
    "status": "published"
  },
  {
    "id": "sent.other_nouns.b1.013",
    "topic": "other_nouns",
    "stage": "B",
    "en": "I have one more thing to say.",
    "zh": "我還有一件事要說。",
    "grammar_point": "名詞 thing",
    "vocab_ids": ["voc.other_nouns.014"],
    "status": "published"
  },
  {
    "id": "sent.other_nouns.b1.014",
    "topic": "other_nouns",
    "stage": "B",
    "en": "I bought two tickets for the movie.",
    "zh": "我買了兩張電影票。",
    "grammar_point": "名詞 ticket",
    "vocab_ids": ["voc.other_nouns.015"],
    "status": "published"
  },
  {
    "id": "sent.other_nouns.b1.015",
    "topic": "other_nouns",
    "stage": "B",
    "en": "Please take out the trash.",
    "zh": "請把垃圾拿出去。",
    "grammar_point": "名詞 trash",
    "vocab_ids": ["voc.other_nouns.016"],
    "status": "published"
  },
  {
    "id": "sent.other_nouns.b1.016",
    "topic": "other_nouns",
    "stage": "B",
    "en": "We planted a tree in the yard.",
    "zh": "我們在院子種了一棵樹。",
    "grammar_point": "名詞 tree",
    "vocab_ids": ["voc.other_nouns.017"],
    "status": "published"
  },
  {
    "id": "sent.other_nouns.b1.017",
    "topic": "other_nouns",
    "stage": "B",
    "en": "I know a fast way to school.",
    "zh": "我知道一條快到學校的路。",
    "grammar_point": "名詞 way",
    "vocab_ids": ["voc.other_nouns.018"],
    "status": "published"
  },
  {
    "id": "sent.other_nouns.b1.018",
    "topic": "other_nouns",
    "stage": "B",
    "en": "I learned a new word today.",
    "zh": "我今天學了一個新單字。",
    "grammar_point": "名詞 word",
    "vocab_ids": ["voc.other_nouns.019"],
    "status": "published"
  }
]
